,audio_preview_url,description,duration_ms,explicit,href,html_description,id,images,is_externally_hosted,is_playable,language,languages,name,release_date,release_date_precision,type,uri,external_urls.spotify,resume_point.fully_played,resume_point.resume_position_ms,book_chapter_verse,book,chapter
404,https://podz-content.spotifycdn.com/audio/clips/6UB14Lfj7rH5XRNSQu31Mx/clip_243600_313400.mp3,"To support the ministry and access exclusive content, go to: ⁠⁠⁠http://patreon.com/logicalbiblestudy⁠⁠⁠ For complete verse-by-verse audio commentaries from Logical Bible Study, go to: ⁠⁠⁠https://mysoundwise.com/publishers/1677296682850p  Matthew 11: 25-30 - 'You have hidden these things from the wise and revealed them to little children.'  Catechism of the Catholic Church Paragraphs: - 2603 (in 'Jesus Prays') - The evangelists have preserved two more explicit prayers offered by Christ during his public ministry. Each begins with thanksgiving. In the first, Jesus confesses the Father, acknowledges, and blesses him because he has hidden the mysteries of the Kingdom from those who think themselves learned and has revealed them to infants, the poor of the Beatitudes. His exclamation, ""Yes, Father!"" expresses the depth of his heart, his adherence to the Father's ""good pleasure,"" echoing his mother's Fiat at the time of his conception and prefiguring what he will say to the Father in his agony. the whole prayer of Jesus is contained in this loving adherence of his human heart to the mystery of the will of the Father. - 2701 (in 'Vocal Prayer') - Vocal prayer is an essential element of the Christian life. To his disciples, drawn by their Master's silent prayer, Jesus teaches a vocal prayer, the Our Father. He not only prayed aloud the liturgical prayers of the synagogue but, as the Gospels show, he raised his voice to express his personal prayer, from exultant blessing of the Father to the agony of Gesthemani. - 2785 (in 'Abba-Father') - Second, a humble and trusting heart that enables us ""to turn and become like children"": for it is to ""little children"" that the Father is revealed. [The prayer is accomplished] by the contemplation of God alone, and by the warmth of love, through which the soul, molded and directed to love him, speaks very familiarly to God as to its own Father with special devotion (abbreviated). - 240 (in 'The Father Revealed by the Son') - Jesus revealed that God is Father in an unheard-of sense: he is Father not only in being Creator; he is eternally Father by his relationship to his only Son who is eternally Son only in relation to his Father: ""No one knows the Son except the Father, and no one knows the Father except the Son and any one to whom the Son chooses to reveal him."" - 473 (in 'Christ's Soul and his human knowledge') - But at the same time, this truly human knowledge of God's Son expressed the divine life of his person. ""The human nature of God's Son, not by itself but by its union with the Word, knew and showed forth in itself everything that pertains to God."" Such is first of all the case with the intimate and immediate knowledge that the Son of God made man has of his Father (abbreviated). - 459 (in 'Why did the Word become Flesh') - The Word became flesh to be our model of holiness: “Take my yoke upon you, and learn from me.” “I am the way, and the truth, and the life; no one comes to the Father, but by me"" (abbreviated). - 1615 (in 'Marriage in the Lord') - This unequivocal insistence on the indissolubility of the marriage bond may have left some perplexed and could seem to be a demand impossible to realize. However, Jesus has not placed on spouses a burden impossible to bear, or too heavy—heavier than the Law of Moses. By coming to restore the original order of creation disturbed by sin, he himself gives the strength and grace to live marriage in the new dimension of the Reign of God. It is by following Christ, renouncing themselves, and taking up their crosses that spouses will be able to “receive” the original meaning of marriage and live it with the help of Christ (abbreviated). - 544 (in 'The Proclamation of the Kingdom of God')  Got a Bible question? Send an email to logicalbiblestudy@gmail.com, and it will be answered in an upcoming episode!  ---   Send in a voice message: https://podcasters.spotify.com/pod/show/daily-gospel-exegesis/message",1440658,False,https://api.spotify.com/v1/episodes/1UdKquHLRMIJx6fuODJnGV,"<p>To support the ministry and access exclusive content, go to: <a href=""https://www.patreon.com/logicalbiblestudy"" rel=""nofollow"">⁠⁠⁠http://patreon.com/logicalbiblestudy⁠⁠⁠</a></p><br/><p>For complete verse-by-verse audio commentaries from Logical Bible Study, go to: <a href=""https://mysoundwise.com/publishers/1677296682850p"" rel=""nofollow"">⁠⁠⁠https://mysoundwise.com/publishers/1677296682850p</a></p><br/><p><br /></p><br/><p>Matthew 11: 25-30 - &#39;You have hidden these things from the wise and revealed them to little children.&#39;</p><br/><p><br /></p><br/><p>Catechism of the Catholic Church Paragraphs:</p><br/><p>- 2603 (in &#39;Jesus Prays&#39;) - The evangelists have preserved two more explicit prayers offered by Christ during his public ministry. Each begins with thanksgiving. In the first, Jesus confesses the Father, acknowledges, and blesses him because he has hidden the mysteries of the Kingdom from those who think themselves learned and has revealed them to infants, the poor of the Beatitudes. His exclamation, &#34;Yes, Father!&#34; expresses the depth of his heart, his adherence to the Father&#39;s &#34;good pleasure,&#34; echoing his mother&#39;s Fiat at the time of his conception and prefiguring what he will say to the Father in his agony. the whole prayer of Jesus is contained in this loving adherence of his human heart to the mystery of the will of the Father.</p><br/><p>- 2701 (in &#39;Vocal Prayer&#39;) - Vocal prayer is an essential element of the Christian life. To his disciples, drawn by their Master&#39;s silent prayer, Jesus teaches a vocal prayer, the Our Father. He not only prayed aloud the liturgical prayers of the synagogue but, as the Gospels show, he raised his voice to express his personal prayer, from exultant blessing of the Father to the agony of Gesthemani.</p><br/><p>- 2785 (in &#39;Abba-Father&#39;) - Second, a humble and trusting heart that enables us &#34;to turn and become like children&#34;: for it is to &#34;little children&#34; that the Father is revealed. [The prayer is accomplished] by the contemplation of God alone, and by the warmth of love, through which the soul, molded and directed to love him, speaks very familiarly to God as to its own Father with special devotion (abbreviated).</p><br/><p>- 240 (in &#39;The Father Revealed by the Son&#39;) - Jesus revealed that God is Father in an unheard-of sense: he is Father not only in being Creator; he is eternally Father by his relationship to his only Son who is eternally Son only in relation to his Father: &#34;No one knows the Son except the Father, and no one knows the Father except the Son and any one to whom the Son chooses to reveal him.&#34;</p><br/><p>- 473 (in &#39;Christ&#39;s Soul and his human knowledge&#39;) - But at the same time, this truly human knowledge of God&#39;s Son expressed the divine life of his person. &#34;The human nature of God&#39;s Son, not by itself but by its union with the Word, knew and showed forth in itself everything that pertains to God.&#34; Such is first of all the case with the intimate and immediate knowledge that the Son of God made man has of his Father (abbreviated).</p><br/><p>- 459 (in &#39;Why did the Word become Flesh&#39;) - The Word became flesh to be our model of holiness: “Take my yoke upon you, and learn from me.” “I am the way, and the truth, and the life; no one comes to the Father, but by me&#34; (abbreviated).</p><br/><p>- 1615 (in &#39;Marriage in the Lord&#39;) - This unequivocal insistence on the indissolubility of the marriage bond may have left some perplexed and could seem to be a demand impossible to realize. However, Jesus has not placed on spouses a burden impossible to bear, or too heavy—heavier than the Law of Moses. By coming to restore the original order of creation disturbed by sin, he himself gives the strength and grace to live marriage in the new dimension of the Reign of God. It is by following Christ, renouncing themselves, and taking up their crosses that spouses will be able to “receive” the original meaning of marriage and live it with the help of Christ (abbreviated).</p><br/><p>- 544 (in &#39;The Proclamation of the Kingdom of God&#39;)</p><br/><p><br /></p><br/><p>Got a Bible question? Send an email to logicalbiblestudy&#64;gmail.com, and it will be answered in an upcoming episode!</p><br/>--- <br/>Send in a voice message: https://podcasters.spotify.com/pod/show/daily-gospel-exegesis/message",1UdKquHLRMIJx6fuODJnGV,"[{'height': 640, 'url': 'https://i.scdn.co/image/ab6765630000ba8a0a9b8daf7c7719b33ed7863e', 'width': 640}, {'height': 300, 'url': 'https://i.scdn.co/image/ab67656300005f1f0a9b8daf7c7719b33ed7863e', 'width': 300}, {'height': 64, 'url': 'https://i.scdn.co/image/ab6765630000f68d0a9b8daf7c7719b33ed7863e', 'width': 64}]",False,True,en,['en'],Solemnity of the Most Sacred Heart of Jesus (Year A) - Matt 11: 25-30,2023-06-15,day,episode,spotify:episode:1UdKquHLRMIJx6fuODJnGV,https://open.spotify.com/episode/1UdKquHLRMIJx6fuODJnGV,False,0,Matt 11: 25-30,Matt,11.0
419,https://podz-content.spotifycdn.com/audio/clips/2ltDiUYK2r1c62bvtYFOBh/clip_249600_294500.mp3,"To support the ministry and access exclusive content, go to: ⁠⁠⁠⁠http://patreon.com/logicalbiblestudy⁠⁠⁠⁠ For complete verse-by-verse audio commentaries from Logical Bible Study, go to: ⁠⁠⁠⁠https://mysoundwise.com/publishers/1677296682850p  Matthew 11: 16-19 - 'They heed neither John nor the Son of Man.'  Got a Bible question? Send an email to logicalbiblestudy@gmail.com, and it will be answered in an upcoming episode!  ---   Send in a voice message: https://podcasters.spotify.com/pod/show/daily-gospel-exegesis/message",1078822,False,https://api.spotify.com/v1/episodes/60XUshlQVFiUsGjNJAmTTp,"<p>To support the ministry and access exclusive content, go to: <a href=""https://www.patreon.com/logicalbiblestudy"" rel=""nofollow"">⁠⁠⁠⁠http://patreon.com/logicalbiblestudy⁠⁠⁠⁠</a></p><br/><p>For complete verse-by-verse audio commentaries from Logical Bible Study, go to: <a href=""https://mysoundwise.com/publishers/1677296682850p"" rel=""nofollow"">⁠⁠⁠⁠https://mysoundwise.com/publishers/1677296682850p</a></p><br/><p><br /></p><br/><p>Matthew 11: 16-19 - &#39;They heed neither John nor the Son of Man.&#39;</p><br/><p><br /></p><br/><p>Got a Bible question? Send an email to logicalbiblestudy&#64;gmail.com, and it will be answered in an upcoming episode!</p><br/>--- <br/>Send in a voice message: https://podcasters.spotify.com/pod/show/daily-gospel-exegesis/message",60XUshlQVFiUsGjNJAmTTp,"[{'height': 640, 'url': 'https://i.scdn.co/image/ab6765630000ba8aa10898a57fb4740a3aa6ef3f', 'width': 640}, {'height': 300, 'url': 'https://i.scdn.co/image/ab67656300005f1fa10898a57fb4740a3aa6ef3f', 'width': 300}, {'height': 64, 'url': 'https://i.scdn.co/image/ab6765630000f68da10898a57fb4740a3aa6ef3f', 'width': 64}]",False,True,en,['en'],Friday of Week 2 of Advent - Matt 11: 16-19,2023-12-14,day,episode,spotify:episode:60XUshlQVFiUsGjNJAmTTp,https://open.spotify.com/episode/60XUshlQVFiUsGjNJAmTTp,False,0,Matt 11: 16-19,Matt,11.0
432,https://podz-content.spotifycdn.com/audio/clips/6CI4lCz4l1E5iWQx7UeLUL/clip_363007_423007.mp3,"To support the ministry and access exclusive content, go to: ⁠⁠⁠⁠http://patreon.com/logicalbiblestudy⁠⁠⁠⁠ For complete verse-by-verse audio commentaries from Logical Bible Study, go to: ⁠⁠⁠⁠https://mysoundwise.com/publishers/1677296682850p  Matthew 11: 11-15 - 'A greater than John the Baptist has never been seen; yet the least in the kingdom of heaven is greater than he is.'  Catechism of the Catholic Church Paragraphs: - 523 (in 'The Preparations of Jesus' Life') - St. John the Baptist is the Lord’s immediate precursor or forerunner, sent to prepare his way. “Prophet of the Most High,” John surpasses all the prophets, of whom he is the last. He inaugurates the Gospel, already from his mother’s womb welcomes the coming of Christ (abbreviated) - 719 (in 'John, precursor, prophet and baptist') - John the Baptist is “more than a prophet.” In him, the Holy Spirit concludes his speaking through the prophets. John completes the cycle of prophets begun by Elijah. He proclaims the imminence of the consolation of Israel; he is the “voice” of the Consoler who is coming (abbreviated).  Got a Bible question? Send an email to logicalbiblestudy@gmail.com, and it will be answered in an upcoming episode!  ---   Send in a voice message: https://podcasters.spotify.com/pod/show/daily-gospel-exegesis/message",1059410,False,https://api.spotify.com/v1/episodes/30Zf3X3TasPsoZS4zY11eu,"<p>To support the ministry and access exclusive content, go to: <a href=""https://www.patreon.com/logicalbiblestudy"" rel=""nofollow"">⁠⁠⁠⁠http://patreon.com/logicalbiblestudy⁠⁠⁠⁠</a></p><br/><p>For complete verse-by-verse audio commentaries from Logical Bible Study, go to: <a href=""https://mysoundwise.com/publishers/1677296682850p"" rel=""nofollow"">⁠⁠⁠⁠https://mysoundwise.com/publishers/1677296682850p</a></p><br/><p><br /></p><br/><p>Matthew 11: 11-15 - &#39;A greater than John the Baptist has never been seen; yet the least in the kingdom of heaven is greater than he is.&#39;</p><br/><p><br /></p><br/><p>Catechism of the Catholic Church Paragraphs:</p><br/><p>- 523 (in &#39;The Preparations of Jesus&#39; Life&#39;) - St. John the Baptist is the Lord’s immediate precursor or forerunner, sent to prepare his way. “Prophet of the Most High,” John surpasses all the prophets, of whom he is the last. He inaugurates the Gospel, already from his mother’s womb welcomes the coming of Christ (abbreviated)</p><br/><p>- 719 (in &#39;John, precursor, prophet and baptist&#39;) - John the Baptist is “more than a prophet.” In him, the Holy Spirit concludes his speaking through the prophets. John completes the cycle of prophets begun by Elijah. He proclaims the imminence of the consolation of Israel; he is the “voice” of the Consoler who is coming (abbreviated).</p><br/><p><br /></p><br/><p>Got a Bible question? Send an email to logicalbiblestudy&#64;gmail.com, and it will be answered in an upcoming episode!</p><br/>--- <br/>Send in a voice message: https://podcasters.spotify.com/pod/show/daily-gospel-exegesis/message",30Zf3X3TasPsoZS4zY11eu,"[{'height': 640, 'url': 'https://i.scdn.co/image/87b71c308a1fc07a47692f585d73f49a23cac6d8', 'width': 640}, {'height': 300, 'url': 'https://i.scdn.co/image/4111943dec5eca29372aee1c85d926794608e061', 'width': 300}, {'height': 64, 'url': 'https://i.scdn.co/image/73fb3c0e9b3dec80877f5bbc01de3730fb1cee15', 'width': 64}]",False,True,en,['en'],Thursday of Week 2 of Advent - Matt 11: 11-15,2023-12-13,day,episode,spotify:episode:30Zf3X3TasPsoZS4zY11eu,https://open.spotify.com/episode/30Zf3X3TasPsoZS4zY11eu,False,0,Matt 11: 11-15,Matt,11.0
2,https://podz-content.spotifycdn.com/audio/clips/7t7YsuWlkkUr18e7BwMVCg/clip_374912_434912.mp3,"To support the ministry and access exclusive content, go to: ⁠⁠⁠http://patreon.com/logicalbiblestudy⁠⁠⁠ For complete verse-by-verse audio commentaries from Logical Bible Study, go to: ⁠⁠⁠https://mysoundwise.com/publishers/1677296682850p  Matthew 12: 46-50 - 'My mother and my brothers are anyone who does the will of my Father in heaven.'  Catechism of the Catholic Church Paragraphs: - 764 (in 'The Church - instituted by Christ Jesus') - To welcome Jesus' word is to welcome ""the Kingdom itself."" The seed and beginning of the Kingdom are the ""little flock"" of those whom Jesus came to gather around him, the flock whose shepherd he is. They form Jesus' true family (abbreviated). - 2233 (in  'The Family and the Kingdom') - Becoming a disciple of Jesus means accepting the invitation to belong to God's family, to live in conformity with His way of life: ""For whoever does the will of my Father in heaven is my brother, and sister, and mother."" Parents should welcome and respect with joy and thanksgiving the Lord's call to one of their children to follow him in virginity for the sake of the Kingdom in the consecrated life or in priestly ministry.  Got a Bible question? Send an email to logicalbiblestudy@gmail.com, and it will be answered in an upcoming episode!  ---   Send in a voice message: https://podcasters.spotify.com/pod/show/daily-gospel-exegesis/message",1132390,False,https://api.spotify.com/v1/episodes/3s9aSLPPdG7abL1EMsSAFw,"<p>To support the ministry and access exclusive content, go to: <a href=""https://www.patreon.com/logicalbiblestudy"" rel=""nofollow"">⁠⁠⁠http://patreon.com/logicalbiblestudy⁠⁠⁠</a></p><br/><p>For complete verse-by-verse audio commentaries from Logical Bible Study, go to: <a href=""https://mysoundwise.com/publishers/1677296682850p"" rel=""nofollow"">⁠⁠⁠https://mysoundwise.com/publishers/1677296682850p</a></p><br/><p><br /></p><br/><p>Matthew 12: 46-50 - &#39;My mother and my brothers are anyone who does the will of my Father in heaven.&#39;</p><br/><p><br /></p><br/><p>Catechism of the Catholic Church Paragraphs:</p><br/><p>- 764 (in &#39;The Church - instituted by Christ Jesus&#39;) - To welcome Jesus&#39; word is to welcome &#34;the Kingdom itself.&#34; The seed and beginning of the Kingdom are the &#34;little flock&#34; of those whom Jesus came to gather around him, the flock whose shepherd he is. They form Jesus&#39; true family (abbreviated).</p><br/><p>- 2233 (in  &#39;The Family and the Kingdom&#39;) - Becoming a disciple of Jesus means accepting the invitation to belong to God&#39;s family, to live in conformity with His way of life: &#34;For whoever does the will of my Father in heaven is my brother, and sister, and mother.&#34;</p><br/><p>Parents should welcome and respect with joy and thanksgiving the Lord&#39;s call to one of their children to follow him in virginity for the sake of the Kingdom in the consecrated life or in priestly ministry.</p><br/><p><br /></p><br/><p>Got a Bible question? Send an email to logicalbiblestudy&#64;gmail.com, and it will be answered in an upcoming episode!</p><br/>--- <br/>Send in a voice message: https://podcasters.spotify.com/pod/show/daily-gospel-exegesis/message",3s9aSLPPdG7abL1EMsSAFw,"[{'height': 640, 'url': 'https://i.scdn.co/image/ab6765630000ba8aa10898a57fb4740a3aa6ef3f', 'width': 640}, {'height': 300, 'url': 'https://i.scdn.co/image/ab67656300005f1fa10898a57fb4740a3aa6ef3f', 'width': 300}, {'height': 64, 'url': 'https://i.scdn.co/image/ab6765630000f68da10898a57fb4740a3aa6ef3f', 'width': 64}]",False,True,en,['en'],Tuesday of Week 16 in Ordinary Time - Matt 12: 46-50,2023-07-24,day,episode,spotify:episode:3s9aSLPPdG7abL1EMsSAFw,https://open.spotify.com/episode/3s9aSLPPdG7abL1EMsSAFw,False,0,Matt 12: 46-50,Matt,12.0
266,https://podz-content.spotifycdn.com/audio/clips/2cNh6Gz30IHKp2wZcKpgP8/clip_222449_282449.mp3,"To support the ministry and access exclusive content, go to: ⁠⁠⁠http://patreon.com/logicalbiblestudy⁠⁠⁠ For complete verse-by-verse audio commentaries from Logical Bible Study, go to: ⁠⁠⁠https://mysoundwise.com/publishers/1677296682850p  Matthew 12: 14-21 - 'He cured them all but warned them not to make him known.'  Catechism of the Catholic Church Paragraphs: - 713 (in 'Expectation of the Messiah and his Spirit') - The Messiah's characteristics are revealed above all in the ""Servant songs."" These songs proclaim the meaning of Jesus' Passion and show how he will pour out the Holy Spirit to give life to the many: not as an outsider, but by embracing our ""form as slave."" Taking our death upon himself, he can communicate to us his own Spirit of life.  Got a Bible question? Send an email to logicalbiblestudy@gmail.com, and it will be answered in an upcoming episode!  ---   Send in a voice message: https://podcasters.spotify.com/pod/show/daily-gospel-exegesis/message",998992,False,https://api.spotify.com/v1/episodes/2lOxgoFnTxFFyLEjjz0ast,"<p>To support the ministry and access exclusive content, go to: <a href=""https://www.patreon.com/logicalbiblestudy"" rel=""nofollow"">⁠⁠⁠http://patreon.com/logicalbiblestudy⁠⁠⁠</a></p><br/><p>For complete verse-by-verse audio commentaries from Logical Bible Study, go to: <a href=""https://mysoundwise.com/publishers/1677296682850p"" rel=""nofollow"">⁠⁠⁠https://mysoundwise.com/publishers/1677296682850p</a></p><br/><p><br /></p><br/><p>Matthew 12: 14-21 - &#39;He cured them all but warned them not to make him known.&#39;</p><br/><p><br /></p><br/><p>Catechism of the Catholic Church Paragraphs:</p><br/><p>- 713 (in &#39;Expectation of the Messiah and his Spirit&#39;) - The Messiah&#39;s characteristics are revealed above all in the &#34;Servant songs.&#34; These songs proclaim the meaning of Jesus&#39; Passion and show how he will pour out the Holy Spirit to give life to the many: not as an outsider, but by embracing our &#34;form as slave.&#34; Taking our death upon himself, he can communicate to us his own Spirit of life.</p><br/><p><br /></p><br/><p>Got a Bible question? Send an email to logicalbiblestudy&#64;gmail.com, and it will be answered in an upcoming episode!</p><br/>--- <br/>Send in a voice message: https://podcasters.spotify.com/pod/show/daily-gospel-exegesis/message",2lOxgoFnTxFFyLEjjz0ast,"[{'height': 640, 'url': 'https://i.scdn.co/image/ab6765630000ba8aa10898a57fb4740a3aa6ef3f', 'width': 640}, {'height': 300, 'url': 'https://i.scdn.co/image/ab67656300005f1fa10898a57fb4740a3aa6ef3f', 'width': 300}, {'height': 64, 'url': 'https://i.scdn.co/image/ab6765630000f68da10898a57fb4740a3aa6ef3f', 'width': 64}]",False,True,en,['en'],Saturday of Week 15 in Ordinary Time - Matt 12: 14-21,2023-07-21,day,episode,spotify:episode:2lOxgoFnTxFFyLEjjz0ast,https://open.spotify.com/episode/2lOxgoFnTxFFyLEjjz0ast,False,0,Matt 12: 14-21,Matt,12.0
