,audio_preview_url,description,duration_ms,explicit,href,html_description,id,images,is_externally_hosted,is_playable,language,languages,name,release_date,release_date_precision,type,uri,external_urls.spotify,resume_point.fully_played,resume_point.resume_position_ms,book_chapter_verse,book,chapter
199,https://podz-content.spotifycdn.com/audio/clips/28O0gO2hWk3uKO2eivwzts/clip_591123_651123.mp3,"To support the ministry and access exclusive content, go to: ⁠⁠⁠http://patreon.com/logicalbiblestudy⁠⁠⁠ For complete verse-by-verse audio commentaries from Logical Bible Study, go to: ⁠⁠⁠https://mysoundwise.com/publishers/1677296682850p  Matthew 6: 24-34 - 'Do not worry about tomorrow: your Holy Father knows your needs.'  Catechism of the Catholic Church Paragraphs: - 2113 (in 'Idolatry') - Idolatry not only refers to false pagan worship. It remains a constant temptation to faith. Idolatry consists in divinizing what is not God. Man commits idolatry whenever he honors and reveres a creature in place of God, whether this be gods or demons (for example, satanism), power, pleasure, race, ancestors, the state, money, etc. Jesus says, ""You cannot serve God and mammon."" Many martyrs died for not adoring ""the Beast"" refusing even to simulate such worship. Idolatry rejects the unique Lordship of God; it is therefore incompatible with communion with God. - 2424 (in 'The Social Doctrine of the Church') - A theory that makes profit the exclusive norm and ultimate end of economic activity is morally unacceptable. The disordered desire for money cannot but produce perverse effects. It is one of the causes of the many conflicts which disturb the social order. A system that ""subordinates the basic rights of individuals and of groups to the collective organization of production"" is contrary to human dignity. Every practice that reduces persons to nothing more than a means of profit enslaves man, leads to idolizing money, and contributes to the spread of atheism. ""You cannot serve God and mammon."" - 2729 (in 'Facing Difficulties in Prayer') - The habitual difficulty in prayer is distraction. It can affect words and their meaning in vocal prayer; it can concern, more profoundly, him to whom we are praying, in vocal prayer (liturgical or personal), meditation, and contemplative prayer. To set about hunting down distractions would be to fall into their trap, when all that is necessary is to turn back to our heart: for a distraction reveals to us what we are attached to, and this humble awareness before the Lord should awaken our preferential love for him and lead us resolutely to offer him our heart to be purified. Therein lies the battle, the choice of which master to serve. - 2547 (in 'Poverty of Heart') - The Lord grieves over the rich, because they find their consolation in the abundance of goods. ""Let the proud seek and love earthly kingdoms, but blessed are the poor in spirit for theirs is the Kingdom of heaven."" Abandonment to the providence of the Father in heaven frees us from anxiety about tomorrow (abbreviated). - 2830 (in 'Give us this day our daily bread') - ""Our bread"": the Father who gives us life cannot not but give us the nourishment life requires - all appropriate goods and blessings, both material and spiritual. In the Sermon on the Mount, Jesus insists on the filial trust that cooperates with our Father's providence. He is not inviting us to idleness, but wants to relieve us from nagging worry and preoccupation. Such is the filial surrender of the children of God: To those who seek the kingdom of God and his righteousness, he has promised to give all else besides. Since everything indeed belongs to God, he who possesses God wants for nothing, if he himself is not found wanting before God. - 2416 (in 'Respect for the Integrity of Creation') - Animals are God's creatures. He surrounds them with his providential care. By their mere existence they bless him and give him glory (abbreviated). - 305 (in 'Divine Providence') - 1942 (in 'Human Solidarity') - 2632 (in 'Prayer of Petition') - 2659 (in 'Today')  Got a Bible question? Send an email to logicalbiblestudy@gmail.com, and it will be answered in an upcoming episode!  ---   Send in a voice message: https://podcasters.spotify.com/pod/show/daily-gospel-exegesis/message",2185044,False,https://api.spotify.com/v1/episodes/7oN1JHDFgZu7sUWlBt5zGl,"<p>To support the ministry and access exclusive content, go to: <a href=""https://www.patreon.com/logicalbiblestudy"" rel=""nofollow"">⁠⁠⁠http://patreon.com/logicalbiblestudy⁠⁠⁠</a></p><br/><p>For complete verse-by-verse audio commentaries from Logical Bible Study, go to: <a href=""https://mysoundwise.com/publishers/1677296682850p"" rel=""nofollow"">⁠⁠⁠https://mysoundwise.com/publishers/1677296682850p</a></p><br/><p><br /></p><br/><p>Matthew 6: 24-34 - &#39;Do not worry about tomorrow: your Holy Father knows your needs.&#39;</p><br/><p><br /></p><br/><p>Catechism of the Catholic Church Paragraphs:</p><br/><p>- 2113 (in &#39;Idolatry&#39;) - Idolatry not only refers to false pagan worship. It remains a constant temptation to faith. Idolatry consists in divinizing what is not God. Man commits idolatry whenever he honors and reveres a creature in place of God, whether this be gods or demons (for example, satanism), power, pleasure, race, ancestors, the state, money, etc. Jesus says, &#34;You cannot serve God and mammon.&#34; Many martyrs died for not adoring &#34;the Beast&#34; refusing even to simulate such worship. Idolatry rejects the unique Lordship of God; it is therefore incompatible with communion with God.</p><br/><p>- 2424 (in &#39;The Social Doctrine of the Church&#39;) - A theory that makes profit the exclusive norm and ultimate end of economic activity is morally unacceptable. The disordered desire for money cannot but produce perverse effects. It is one of the causes of the many conflicts which disturb the social order. A system that &#34;subordinates the basic rights of individuals and of groups to the collective organization of production&#34; is contrary to human dignity. Every practice that reduces persons to nothing more than a means of profit enslaves man, leads to idolizing money, and contributes to the spread of atheism. &#34;You cannot serve God and mammon.&#34;</p><br/><p>- 2729 (in &#39;Facing Difficulties in Prayer&#39;) - The habitual difficulty in prayer is distraction. It can affect words and their meaning in vocal prayer; it can concern, more profoundly, him to whom we are praying, in vocal prayer (liturgical or personal), meditation, and contemplative prayer. To set about hunting down distractions would be to fall into their trap, when all that is necessary is to turn back to our heart: for a distraction reveals to us what we are attached to, and this humble awareness before the Lord should awaken our preferential love for him and lead us resolutely to offer him our heart to be purified. Therein lies the battle, the choice of which master to serve.</p><br/><p>- 2547 (in &#39;Poverty of Heart&#39;) - The Lord grieves over the rich, because they find their consolation in the abundance of goods. &#34;Let the proud seek and love earthly kingdoms, but blessed are the poor in spirit for theirs is the Kingdom of heaven.&#34; Abandonment to the providence of the Father in heaven frees us from anxiety about tomorrow (abbreviated).</p><br/><p>- 2830 (in &#39;Give us this day our daily bread&#39;) - &#34;Our bread&#34;: the Father who gives us life cannot not but give us the nourishment life requires - all appropriate goods and blessings, both material and spiritual. In the Sermon on the Mount, Jesus insists on the filial trust that cooperates with our Father&#39;s providence. He is not inviting us to idleness, but wants to relieve us from nagging worry and preoccupation. Such is the filial surrender of the children of God: To those who seek the kingdom of God and his righteousness, he has promised to give all else besides. Since everything indeed belongs to God, he who possesses God wants for nothing, if he himself is not found wanting before God.</p><br/><p>- 2416 (in &#39;Respect for the Integrity of Creation&#39;) - Animals are God&#39;s creatures. He surrounds them with his providential care. By their mere existence they bless him and give him glory (abbreviated).</p><br/><p>- 305 (in &#39;Divine Providence&#39;)</p><br/><p>- 1942 (in &#39;Human Solidarity&#39;)</p><br/><p>- 2632 (in &#39;Prayer of Petition&#39;)</p><br/><p>- 2659 (in &#39;Today&#39;)</p><br/><p><br /></p><br/><p>Got a Bible question? Send an email to logicalbiblestudy&#64;gmail.com, and it will be answered in an upcoming episode!</p><br/>--- <br/>Send in a voice message: https://podcasters.spotify.com/pod/show/daily-gospel-exegesis/message",7oN1JHDFgZu7sUWlBt5zGl,"[{'height': 640, 'url': 'https://i.scdn.co/image/ab6765630000ba8aa10898a57fb4740a3aa6ef3f', 'width': 640}, {'height': 300, 'url': 'https://i.scdn.co/image/ab67656300005f1fa10898a57fb4740a3aa6ef3f', 'width': 300}, {'height': 64, 'url': 'https://i.scdn.co/image/ab6765630000f68da10898a57fb4740a3aa6ef3f', 'width': 64}]",False,True,en,['en'],Saturday of Week 11 in Ordinary Time - Matt 6: 24-34,2023-06-23,day,episode,spotify:episode:7oN1JHDFgZu7sUWlBt5zGl,https://open.spotify.com/episode/7oN1JHDFgZu7sUWlBt5zGl,False,0,Matt 6: 24-34,Matt,6.0
203,https://podz-content.spotifycdn.com/audio/clips/0kwoNScqHgQX053AGkvvzn/clip_804700_860500.mp3,"To support the ministry and access exclusive content, go to: ⁠⁠⁠http://patreon.com/logicalbiblestudy⁠⁠⁠ For complete verse-by-verse audio commentaries from Logical Bible Study, go to: ⁠⁠⁠https://mysoundwise.com/publishers/1677296682850p  Matt 6: 19-23 - 'Store up treasure for yourselves in Heaven.'  Catechism of the Catholic Church Paragraphs: - 368 (in 'Body and Soul but Truly One') - The spiritual tradition of the Church also emphasizes the heart, in the biblical sense of the depths of one's being, where the person decides for or against God. - 2533 (in 'The Ninth Commandment') - Purity of heart requires the modesty which is patience, decency, and discretion. Modesty protects the intimate center of the person. - 2551 (in 'The Tenth Commandment') - ""Where your treasure is, there will your heart be also."" - 2604 (in 'Jesus Prays') - Jesus' prayer, characterized by thanksgiving, reveals to us how to ask: before the gift is given, Jesus commits himself to the One who in giving gives himself. the Giver is more precious than the gift; he is the ""treasure""; in him abides his Son's heart; the gift is given ""as well"" (abbreviated). - 2608 (in 'Jesus Teaches us how to pray') - From the Sermon on the Mount onwards, Jesus insists on conversion of heart: reconciliation with one's brother before presenting an offering on the altar, love of enemies, and prayer for persecutors, prayer to the Father in secret, not heaping up empty phrases, prayerful forgiveness from the depths of the heart, purity of heart, and seeking the Kingdom before all else. This filial conversion is entirely directed to the Father. - 2729 (in 'Facing Difficulties in Prayer') - The habitual difficulty in prayer is distraction. It can affect words and their meaning in vocal prayer; it can concern, more profoundly, him to whom we are praying, in vocal prayer (liturgical or personal), meditation, and contemplative prayer. To set about hunting down distractions would be to fall into their trap, when all that is necessary is to turn back to our heart: for a distraction reveals to us what we are attached to, and this humble awareness before the Lord should awaken our preferential love for him and lead us resolutely to offer him our heart to be purified. Therein lies the battle, the choice of which master to serve. - 2848 (in 'And Lead us not into temptation') - ""Lead us not into temptation"" implies a decision of the heart: ""For where your treasure is, there will your heart be also.... No one can serve two masters."" ""If we live by the Spirit, let us also walk by the Spirit."" In this assent to the Holy Spirit the Father gives us strength. ""No testing has overtaken you that is not common to man. God is faithful, and he will not let you be tempted beyond your strength, but with the temptation will also provide the way of escape, so that you may be able to endure it.""  Got a Bible question? Send an email to logicalbiblestudy@gmail.com, and it will be answered in an upcoming episode!  ---   Send in a voice message: https://podcasters.spotify.com/pod/show/daily-gospel-exegesis/message",1146044,False,https://api.spotify.com/v1/episodes/2bWHWi5BS08kUj0kyv5nG9,"<p>To support the ministry and access exclusive content, go to: <a href=""https://www.patreon.com/logicalbiblestudy"" rel=""nofollow"">⁠⁠⁠http://patreon.com/logicalbiblestudy⁠⁠⁠</a></p><br/><p>For complete verse-by-verse audio commentaries from Logical Bible Study, go to: <a href=""https://mysoundwise.com/publishers/1677296682850p"" rel=""nofollow"">⁠⁠⁠https://mysoundwise.com/publishers/1677296682850p</a></p><br/><p><br /></p><br/><p>Matt 6: 19-23 - &#39;Store up treasure for yourselves in Heaven.&#39;</p><br/><p><br /></p><br/><p>Catechism of the Catholic Church Paragraphs:</p><br/><p>- 368 (in &#39;Body and Soul but Truly One&#39;) - The spiritual tradition of the Church also emphasizes the heart, in the biblical sense of the depths of one&#39;s being, where the person decides for or against God.</p><br/><p>- 2533 (in &#39;The Ninth Commandment&#39;) - Purity of heart requires the modesty which is patience, decency, and discretion. Modesty protects the intimate center of the person.</p><br/><p>- 2551 (in &#39;The Tenth Commandment&#39;) - &#34;Where your treasure is, there will your heart be also.&#34;</p><br/><p>- 2604 (in &#39;Jesus Prays&#39;) - Jesus&#39; prayer, characterized by thanksgiving, reveals to us how to ask: before the gift is given, Jesus commits himself to the One who in giving gives himself. the Giver is more precious than the gift; he is the &#34;treasure&#34;; in him abides his Son&#39;s heart; the gift is given &#34;as well&#34; (abbreviated).</p><br/><p>- 2608 (in &#39;Jesus Teaches us how to pray&#39;) - From the Sermon on the Mount onwards, Jesus insists on conversion of heart: reconciliation with one&#39;s brother before presenting an offering on the altar, love of enemies, and prayer for persecutors, prayer to the Father in secret, not heaping up empty phrases, prayerful forgiveness from the depths of the heart, purity of heart, and seeking the Kingdom before all else. This filial conversion is entirely directed to the Father.</p><br/><p>- 2729 (in &#39;Facing Difficulties in Prayer&#39;) - The habitual difficulty in prayer is distraction. It can affect words and their meaning in vocal prayer; it can concern, more profoundly, him to whom we are praying, in vocal prayer (liturgical or personal), meditation, and contemplative prayer. To set about hunting down distractions would be to fall into their trap, when all that is necessary is to turn back to our heart: for a distraction reveals to us what we are attached to, and this humble awareness before the Lord should awaken our preferential love for him and lead us resolutely to offer him our heart to be purified. Therein lies the battle, the choice of which master to serve.</p><br/><p>- 2848 (in &#39;And Lead us not into temptation&#39;) - &#34;Lead us not into temptation&#34; implies a decision of the heart: &#34;For where your treasure is, there will your heart be also.... No one can serve two masters.&#34; &#34;If we live by the Spirit, let us also walk by the Spirit.&#34; In this assent to the Holy Spirit the Father gives us strength. &#34;No testing has overtaken you that is not common to man. God is faithful, and he will not let you be tempted beyond your strength, but with the temptation will also provide the way of escape, so that you may be able to endure it.&#34;</p><br/><p><br /></p><br/><p>Got a Bible question? Send an email to logicalbiblestudy&#64;gmail.com, and it will be answered in an upcoming episode!</p><br/>--- <br/>Send in a voice message: https://podcasters.spotify.com/pod/show/daily-gospel-exegesis/message",2bWHWi5BS08kUj0kyv5nG9,"[{'height': 640, 'url': 'https://i.scdn.co/image/ab6765630000ba8aa10898a57fb4740a3aa6ef3f', 'width': 640}, {'height': 300, 'url': 'https://i.scdn.co/image/ab67656300005f1fa10898a57fb4740a3aa6ef3f', 'width': 300}, {'height': 64, 'url': 'https://i.scdn.co/image/ab6765630000f68da10898a57fb4740a3aa6ef3f', 'width': 64}]",False,True,en,['en'],Friday of Week 11 in Ordinary Time - Matt 6: 19-23,2023-06-22,day,episode,spotify:episode:2bWHWi5BS08kUj0kyv5nG9,https://open.spotify.com/episode/2bWHWi5BS08kUj0kyv5nG9,False,0,Matt 6: 19-23,Matt,6.0
274,https://podz-content.spotifycdn.com/audio/clips/6ktEdYedJOYqeNresW0IEI/clip_678300_727000.mp3,"To support the ministry and access exclusive content, go to: ⁠⁠⁠http://patreon.com/logicalbiblestudy⁠⁠⁠ For complete verse-by-verse audio commentaries from Logical Bible Study, go to: ⁠⁠⁠https://mysoundwise.com/publishers/1677296682850p  Matthew 6: 7-15 - 'How to pray.'  Catechism of the Catholic Church Paragraphs: - 2759-2856 - Entire section of the Catechism which covers the Our Father. - 2608 (in 'Jesus teaches us how to pray') - From the Sermon on the Mount onwards, Jesus insists on conversion of heart: reconciliation with one's brother before presenting an offering on the altar, love of enemies, and prayer for persecutors, prayer to the Father in secret, not heaping up empty phrases, prayerful forgiveness from the depths of the heart, purity of heart, and seeking the Kingdom before all else. This filial conversion is entirely directed to the Father. - 2668 (in 'Prayer to Jesus') - The invocation of the holy name of Jesus is the simplest way of praying always. When the holy name is repeated often by a humbly attentive heart, the prayer is not lost by heaping up empty phrases, but holds fast to the word and ""brings forth fruit with patience."" This prayer is possible ""at all times"" because it is not one occupation among others but the only occupation: that of loving God, which animates and transfigures every action in Christ Jesus. - 443 (in 'The Only Son of God') - He distinguished his sonship from that of his disciples by never saying ""our Father"", except to command them: ""You, then, pray like this: 'Our Father'"", and he emphasized this distinction, saying ""my Father and your Father"" (abbreviated) - 2736 (in 'Filial Trust') - Are we asking God for ""what is good for us""? Our Father knows what we need before we ask him, but he awaits our petition because the dignity of his children lies in their freedom. We must pray, then, with his Spirit of freedom, to be able truly to know what he wants. - 1969 (in 'The New Law') - The New Law practices the acts of religion: almsgiving, prayer and fasting, directing them to the ""Father who sees in secret,"" in contrast with the desire to ""be seen by men."" Its prayer is the Our Father. - 268 (in 'The Almighty') - of all the divine attributes, only God's omnipotence is named in the Creed: to confess this power has great bearing on our lives. We believe that his might is universal, for God who created everything also rules everything and can do everything. God's power is loving, for he is our Father, and mysterious, for only faith can discern it when it ""is made perfect in weakness"". - 2632 (in 'Prayer of Petition') - Christian petition is centered on the desire and search for the Kingdom to come, in keeping with the teaching of Christ. There is a hierarchy in these petitions: we pray first for the Kingdom, then for what is necessary to welcome it and cooperate with its coming. .. By prayer every baptized person works for the coming of the Kingdom (abbreviated) - 2659 (in 'Today') - We learn to pray at certain moments by hearing the Word of the Lord and sharing in his Paschal mystery, but his Spirit is offered us at all times, in the events of each day, to make prayer spring up from us. Jesus' teaching about praying to our Father is in the same vein as his teaching about providence: time is in the Father's hands; it is in the present that we encounter him, not yesterday nor tomorrow, but today: ""O that today you would hearken to his voice! Harden not your hearts.""  Got a Bible question? Send an email to logicalbiblestudy@gmail.com, and it will be answered in an upcoming episode!  ---   Send in a voice message: https://podcasters.spotify.com/pod/show/daily-gospel-exegesis/message",1422338,False,https://api.spotify.com/v1/episodes/35EcfUWjfNO40AZrljiuDz,"<p>To support the ministry and access exclusive content, go to: <a href=""https://www.patreon.com/logicalbiblestudy"" rel=""nofollow"">⁠⁠⁠http://patreon.com/logicalbiblestudy⁠⁠⁠</a></p><br/><p>For complete verse-by-verse audio commentaries from Logical Bible Study, go to: <a href=""https://mysoundwise.com/publishers/1677296682850p"" rel=""nofollow"">⁠⁠⁠https://mysoundwise.com/publishers/1677296682850p</a></p><br/><p><br /></p><br/><p>Matthew 6: 7-15 - &#39;How to pray.&#39;</p><br/><p><br /></p><br/><p>Catechism of the Catholic Church Paragraphs:</p><br/><p>- 2759-2856 - Entire section of the Catechism which covers the Our Father.</p><br/><p>- 2608 (in &#39;Jesus teaches us how to pray&#39;) - From the Sermon on the Mount onwards, Jesus insists on conversion of heart: reconciliation with one&#39;s brother before presenting an offering on the altar, love of enemies, and prayer for persecutors, prayer to the Father in secret, not heaping up empty phrases, prayerful forgiveness from the depths of the heart, purity of heart, and seeking the Kingdom before all else. This filial conversion is entirely directed to the Father.</p><br/><p>- 2668 (in &#39;Prayer to Jesus&#39;) - The invocation of the holy name of Jesus is the simplest way of praying always. When the holy name is repeated often by a humbly attentive heart, the prayer is not lost by heaping up empty phrases, but holds fast to the word and &#34;brings forth fruit with patience.&#34; This prayer is possible &#34;at all times&#34; because it is not one occupation among others but the only occupation: that of loving God, which animates and transfigures every action in Christ Jesus.</p><br/><p>- 443 (in &#39;The Only Son of God&#39;) - He distinguished his sonship from that of his disciples by never saying &#34;our Father&#34;, except to command them: &#34;You, then, pray like this: &#39;Our Father&#39;&#34;, and he emphasized this distinction, saying &#34;my Father and your Father&#34; (abbreviated)</p><br/><p>- 2736 (in &#39;Filial Trust&#39;) - Are we asking God for &#34;what is good for us&#34;? Our Father knows what we need before we ask him, but he awaits our petition because the dignity of his children lies in their freedom. We must pray, then, with his Spirit of freedom, to be able truly to know what he wants.</p><br/><p>- 1969 (in &#39;The New Law&#39;) - The New Law practices the acts of religion: almsgiving, prayer and fasting, directing them to the &#34;Father who sees in secret,&#34; in contrast with the desire to &#34;be seen by men.&#34; Its prayer is the Our Father.</p><br/><p>- 268 (in &#39;The Almighty&#39;) - of all the divine attributes, only God&#39;s omnipotence is named in the Creed: to confess this power has great bearing on our lives. We believe that his might is universal, for God who created everything also rules everything and can do everything. God&#39;s power is loving, for he is our Father, and mysterious, for only faith can discern it when it &#34;is made perfect in weakness&#34;.</p><br/><p>- 2632 (in &#39;Prayer of Petition&#39;) - Christian petition is centered on the desire and search for the Kingdom to come, in keeping with the teaching of Christ. There is a hierarchy in these petitions: we pray first for the Kingdom, then for what is necessary to welcome it and cooperate with its coming. .. By prayer every baptized person works for the coming of the Kingdom (abbreviated)</p><br/><p>- 2659 (in &#39;Today&#39;) - We learn to pray at certain moments by hearing the Word of the Lord and sharing in his Paschal mystery, but his Spirit is offered us at all times, in the events of each day, to make prayer spring up from us. Jesus&#39; teaching about praying to our Father is in the same vein as his teaching about providence: time is in the Father&#39;s hands; it is in the present that we encounter him, not yesterday nor tomorrow, but today: &#34;O that today you would hearken to his voice! Harden not your hearts.&#34;</p><br/><p><br /></p><br/><p>Got a Bible question? Send an email to logicalbiblestudy&#64;gmail.com, and it will be answered in an upcoming episode!</p><br/>--- <br/>Send in a voice message: https://podcasters.spotify.com/pod/show/daily-gospel-exegesis/message",35EcfUWjfNO40AZrljiuDz,"[{'height': 640, 'url': 'https://i.scdn.co/image/87b71c308a1fc07a47692f585d73f49a23cac6d8', 'width': 640}, {'height': 300, 'url': 'https://i.scdn.co/image/4111943dec5eca29372aee1c85d926794608e061', 'width': 300}, {'height': 64, 'url': 'https://i.scdn.co/image/73fb3c0e9b3dec80877f5bbc01de3730fb1cee15', 'width': 64}]",False,True,en,['en'],Thursday of Week 11 in Ordinary Time - Matt 6: 7-15,2023-06-21,day,episode,spotify:episode:35EcfUWjfNO40AZrljiuDz,https://open.spotify.com/episode/35EcfUWjfNO40AZrljiuDz,False,0,Matt 6: 7-15,Matt,6.0
