,audio_preview_url,description,duration_ms,explicit,href,html_description,id,images,is_externally_hosted,is_playable,language,languages,name,release_date,release_date_precision,type,uri,external_urls.spotify,resume_point.fully_played,resume_point.resume_position_ms,book_chapter_verse,book,chapter
1,https://podz-content.spotifycdn.com/audio/clips/3S1Y6EAbUe0B4hpYUdB3fm/clip_621079_681079.mp3,"To support the ministry and access exclusive content, go to: http://patreon.com/logicalbiblestudy For complete verse-by-verse audio commentaries from Logical Bible Study, go to: https://mysoundwise.com/publishers/1677296682850p  Matthew 18: 15-20 - 'If your brother listens to you, you have won back your brother.'  Catechism of the Catholic Church Paragraphs: - 2472 (in 'To Bear Witness to the Truth') - The duty of Christians to take part in the life of the Church impels them to act as witnesses of the Gospel and of the obligations that flow from it. This witness is a transmission of the faith in words and deeds. Witness is an act of justice that establishes the truth or makes it known. - 553 (in 'The Keys of the Kingdom') - The power to ""bind and loose"" connotes the authority to absolve sins, to pronounce doctrinal judgements, and to make disciplinary decisions in the Church. Jesus entrusted this authority to the Church through the ministry of the apostles and in particular through the ministry of Peter, the only one to whom he specifically entrusted the keys of the kingdom (abbreviated). - 1444 (in 'Reconciliation with the Church') - In imparting to his apostles his own power to forgive sins the Lord also gives them the authority to reconcile sinners with the Church. This ecclesial dimension of their task is expressed most notably in Christ's solemn words to Simon Peter: ""I will give you the keys of the kingdom of heaven, and whatever you bind on earth shall be bound in heaven, and whatever you loose on earth shall be loosed in heaven."" ""The office of binding and loosing which was given to Peter was also assigned to the college of the apostles united to its head."" - 1088 (is 'Present in the earthly liturgy') - He is present in his word since it is he himself who speaks when the holy Scriptures are read in the Church. Lastly, he is present when the Church prays and sings, for he has promised 'where two or three are gathered together in my name there am I in the midst of them"" (abbreviated). - 1373 (in 'The Presence of Christ by the power of his word and the Holy Spirit') - ""Christ Jesus, who died, yes, who was raised from the dead, who is at the right hand of God, who indeed intercedes for us,"" is present in many ways to his Church: in his word, in his Church's prayer, ""where two or three are gathered in my name,"" in the poor, the sick, and the imprisoned (abbreviated).  Got a Bible question? Send an email to logicalbiblestudy@gmail.com, and it will be answered in an upcoming episode!  ---   Send in a voice message: https://podcasters.spotify.com/pod/show/daily-gospel-exegesis/message",2075980,False,https://api.spotify.com/v1/episodes/5GrzvuQlsiaGTvsgdCsb5h,"<p>To support the ministry and access exclusive content, go to: <a href=""https://www.patreon.com/logicalbiblestudy"" rel=""nofollow"">http://patreon.com/logicalbiblestudy</a></p><br/><p>For complete verse-by-verse audio commentaries from Logical Bible Study, go to: <a href=""https://mysoundwise.com/publishers/1677296682850p"" rel=""nofollow"">https://mysoundwise.com/publishers/1677296682850p</a></p><br/><p><br /></p><br/><p>Matthew 18: 15-20 - &#39;If your brother listens to you, you have won back your brother.&#39;</p><br/><p><br /></p><br/><p>Catechism of the Catholic Church Paragraphs:</p><br/><p>- 2472 (in &#39;To Bear Witness to the Truth&#39;) - The duty of Christians to take part in the life of the Church impels them to act as witnesses of the Gospel and of the obligations that flow from it. This witness is a transmission of the faith in words and deeds. Witness is an act of justice that establishes the truth or makes it known.</p><br/><p>- 553 (in &#39;The Keys of the Kingdom&#39;) - The power to &#34;bind and loose&#34; connotes the authority to absolve sins, to pronounce doctrinal judgements, and to make disciplinary decisions in the Church. Jesus entrusted this authority to the Church through the ministry of the apostles and in particular through the ministry of Peter, the only one to whom he specifically entrusted the keys of the kingdom (abbreviated).</p><br/><p>- 1444 (in &#39;Reconciliation with the Church&#39;) - In imparting to his apostles his own power to forgive sins the Lord also gives them the authority to reconcile sinners with the Church. This ecclesial dimension of their task is expressed most notably in Christ&#39;s solemn words to Simon Peter: &#34;I will give you the keys of the kingdom of heaven, and whatever you bind on earth shall be bound in heaven, and whatever you loose on earth shall be loosed in heaven.&#34; &#34;The office of binding and loosing which was given to Peter was also assigned to the college of the apostles united to its head.&#34;</p><br/><p>- 1088 (is &#39;Present in the earthly liturgy&#39;) - He is present in his word since it is he himself who speaks when the holy Scriptures are read in the Church. Lastly, he is present when the Church prays and sings, for he has promised &#39;where two or three are gathered together in my name there am I in the midst of them&#34; (abbreviated).</p><br/><p>- 1373 (in &#39;The Presence of Christ by the power of his word and the Holy Spirit&#39;) - &#34;Christ Jesus, who died, yes, who was raised from the dead, who is at the right hand of God, who indeed intercedes for us,&#34; is present in many ways to his Church: in his word, in his Church&#39;s prayer, &#34;where two or three are gathered in my name,&#34; in the poor, the sick, and the imprisoned (abbreviated).</p><br/><p><br /></p><br/><p>Got a Bible question? Send an email to logicalbiblestudy&#64;gmail.com, and it will be answered in an upcoming episode!</p><br/>--- <br/>Send in a voice message: https://podcasters.spotify.com/pod/show/daily-gospel-exegesis/message",5GrzvuQlsiaGTvsgdCsb5h,"[{'height': 640, 'url': 'https://i.scdn.co/image/ab6765630000ba8a0a9b8daf7c7719b33ed7863e', 'width': 640}, {'height': 300, 'url': 'https://i.scdn.co/image/ab67656300005f1f0a9b8daf7c7719b33ed7863e', 'width': 300}, {'height': 64, 'url': 'https://i.scdn.co/image/ab6765630000f68d0a9b8daf7c7719b33ed7863e', 'width': 64}]",False,True,en,['en'],23rd Sunday in Ordinary Time (Year A) - Matt 18: 15-20,2023-09-09,day,episode,spotify:episode:5GrzvuQlsiaGTvsgdCsb5h,https://open.spotify.com/episode/5GrzvuQlsiaGTvsgdCsb5h,False,0,Matt 18: 15-20,Matt,18.0
28,https://podz-content.spotifycdn.com/audio/clips/3xnbNUjDlf1NQoSAvuvxYg/clip_1433200_1477700.mp3,"To support the ministry and access exclusive content, go to: ⁠⁠http://patreon.com/logicalbiblestudy⁠⁠ For complete verse-by-verse audio commentaries from Logical Bible Study, go to: ⁠⁠https://mysoundwise.com/publishers/1677296682850p  Matthew 18: 15-20 - 'If your brother listens to you, you have won back your brother.'  Catechism of the Catholic Church Paragraphs: - 2472 (in 'To Bear Witness to the Truth') - The duty of Christians to take part in the life of the Church impels them to act as witnesses of the Gospel and of the obligations that flow from it. This witness is a transmission of the faith in words and deeds. Witness is an act of justice that establishes the truth or makes it known. - 553 (in 'The Keys of the Kingdom') - The power to ""bind and loose"" connotes the authority to absolve sins, to pronounce doctrinal judgements, and to make disciplinary decisions in the Church. Jesus entrusted this authority to the Church through the ministry of the apostles and in particular through the ministry of Peter, the only one to whom he specifically entrusted the keys of the kingdom (abbreviated). - 1444 (in 'Reconciliation with the Church') - In imparting to his apostles his own power to forgive sins the Lord also gives them the authority to reconcile sinners with the Church. This ecclesial dimension of their task is expressed most notably in Christ's solemn words to Simon Peter: ""I will give you the keys of the kingdom of heaven, and whatever you bind on earth shall be bound in heaven, and whatever you loose on earth shall be loosed in heaven."" ""The office of binding and loosing which was given to Peter was also assigned to the college of the apostles united to its head."" - 1088 (is 'Present in the earthly liturgy') - He is present in his word since it is he himself who speaks when the holy Scriptures are read in the Church. Lastly, he is present when the Church prays and sings, for he has promised 'where two or three are gathered together in my name there am I in the midst of them"" (abbreviated). - 1373 (in 'The Presence of Christ by the power of his word and the Holy Spirit') - ""Christ Jesus, who died, yes, who was raised from the dead, who is at the right hand of God, who indeed intercedes for us,"" is present in many ways to his Church: in his word, in his Church's prayer, ""where two or three are gathered in my name,"" in the poor, the sick, and the imprisoned (abbreviated).  Got a Bible question? Send an email to logicalbiblestudy@gmail.com, and it will be answered in an upcoming episode!  ---   Send in a voice message: https://podcasters.spotify.com/pod/show/daily-gospel-exegesis/message",2075980,False,https://api.spotify.com/v1/episodes/5iw2FoDyGmiERnvID6WxGV,"<p>To support the ministry and access exclusive content, go to: <a href=""https://www.patreon.com/logicalbiblestudy"" rel=""nofollow"">⁠⁠http://patreon.com/logicalbiblestudy⁠⁠</a></p><br/><p>For complete verse-by-verse audio commentaries from Logical Bible Study, go to: <a href=""https://mysoundwise.com/publishers/1677296682850p"" rel=""nofollow"">⁠⁠https://mysoundwise.com/publishers/1677296682850p</a></p><br/><p><br /></p><br/><p>Matthew 18: 15-20 - &#39;If your brother listens to you, you have won back your brother.&#39;</p><br/><p><br /></p><br/><p>Catechism of the Catholic Church Paragraphs:</p><br/><p>- 2472 (in &#39;To Bear Witness to the Truth&#39;) - The duty of Christians to take part in the life of the Church impels them to act as witnesses of the Gospel and of the obligations that flow from it. This witness is a transmission of the faith in words and deeds. Witness is an act of justice that establishes the truth or makes it known.</p><br/><p>- 553 (in &#39;The Keys of the Kingdom&#39;) - The power to &#34;bind and loose&#34; connotes the authority to absolve sins, to pronounce doctrinal judgements, and to make disciplinary decisions in the Church. Jesus entrusted this authority to the Church through the ministry of the apostles and in particular through the ministry of Peter, the only one to whom he specifically entrusted the keys of the kingdom (abbreviated).</p><br/><p>- 1444 (in &#39;Reconciliation with the Church&#39;) - In imparting to his apostles his own power to forgive sins the Lord also gives them the authority to reconcile sinners with the Church. This ecclesial dimension of their task is expressed most notably in Christ&#39;s solemn words to Simon Peter: &#34;I will give you the keys of the kingdom of heaven, and whatever you bind on earth shall be bound in heaven, and whatever you loose on earth shall be loosed in heaven.&#34; &#34;The office of binding and loosing which was given to Peter was also assigned to the college of the apostles united to its head.&#34;</p><br/><p>- 1088 (is &#39;Present in the earthly liturgy&#39;) - He is present in his word since it is he himself who speaks when the holy Scriptures are read in the Church. Lastly, he is present when the Church prays and sings, for he has promised &#39;where two or three are gathered together in my name there am I in the midst of them&#34; (abbreviated).</p><br/><p>- 1373 (in &#39;The Presence of Christ by the power of his word and the Holy Spirit&#39;) - &#34;Christ Jesus, who died, yes, who was raised from the dead, who is at the right hand of God, who indeed intercedes for us,&#34; is present in many ways to his Church: in his word, in his Church&#39;s prayer, &#34;where two or three are gathered in my name,&#34; in the poor, the sick, and the imprisoned (abbreviated).</p><br/><p><br /></p><br/><p>Got a Bible question? Send an email to logicalbiblestudy&#64;gmail.com, and it will be answered in an upcoming episode!</p><br/>--- <br/>Send in a voice message: https://podcasters.spotify.com/pod/show/daily-gospel-exegesis/message",5iw2FoDyGmiERnvID6WxGV,"[{'height': 640, 'url': 'https://i.scdn.co/image/87b71c308a1fc07a47692f585d73f49a23cac6d8', 'width': 640}, {'height': 300, 'url': 'https://i.scdn.co/image/4111943dec5eca29372aee1c85d926794608e061', 'width': 300}, {'height': 64, 'url': 'https://i.scdn.co/image/73fb3c0e9b3dec80877f5bbc01de3730fb1cee15', 'width': 64}]",False,True,en,['en'],Wednesday of Week 19 in Ordinary Time - Matt 18: 15-20,2023-08-15,day,episode,spotify:episode:5iw2FoDyGmiERnvID6WxGV,https://open.spotify.com/episode/5iw2FoDyGmiERnvID6WxGV,False,0,Matt 18: 15-20,Matt,18.0
65,https://podz-content.spotifycdn.com/audio/clips/5y5hfaJN8AxfJG7LW237Kc/clip_1194900_1245300.mp3,"To support the ministry and access exclusive content, go to: ⁠⁠http://patreon.com/logicalbiblestudy⁠⁠ For complete verse-by-verse audio commentaries from Logical Bible Study, go to: ⁠⁠https://mysoundwise.com/publishers/1677296682850p  Matthew 18:21 - 19:1 - 'How often must I forgive my brother?'  Catechism of the Catholic Church Paragraphs: - 982 (in 'The Power of the Keys') - There is no offense, however serious, that the Church cannot forgive. ""There is no one, however wicked and guilty, who may not confidently hope for forgiveness, provided his repentance is honest. Christ who died for all men desires that in his Church the gates of forgiveness should always be open to anyone who turns away from sin. - 2227 (in 'The Duties of Parents') - Each and everyone should be generous and tireless in forgiving one another for offenses, quarrels, injustices, and neglect. Mutual affection suggests this. The charity of Christ demands it. - 2843 (in 'as we forgive those who trespass against us') - Thus the Lord's words on forgiveness, the love that loves to the end, become a living reality. the parable of the merciless servant, which crowns the Lord's teaching on ecclesial communion, ends with these words: ""So also my heavenly Father will do to every one of you, if you do not forgive your brother from your heart."" It is there, in fact, ""in the depths of the heart,"" that everything is bound and loosed. It is not in our power not to feel or to forget an offense; but the heart that offers itself to the Holy Spirit turns injury into compassion and purifies the memory in transforming the hurt into intercession.  Got a Bible question? Send an email to logicalbiblestudy@gmail.com, and it will be answered in an upcoming episode!  ---   Send in a voice message: https://podcasters.spotify.com/pod/show/daily-gospel-exegesis/message",1641627,False,https://api.spotify.com/v1/episodes/0SIROoNCHUsPGiaONSbBj3,"<p>To support the ministry and access exclusive content, go to: <a href=""https://www.patreon.com/logicalbiblestudy"" rel=""nofollow"">⁠⁠http://patreon.com/logicalbiblestudy⁠⁠</a></p><br/><p>For complete verse-by-verse audio commentaries from Logical Bible Study, go to: <a href=""https://mysoundwise.com/publishers/1677296682850p"" rel=""nofollow"">⁠⁠https://mysoundwise.com/publishers/1677296682850p</a></p><br/><p><br /></p><br/><p>Matthew 18:21 - 19:1 - &#39;How often must I forgive my brother?&#39;</p><br/><p><br /></p><br/><p>Catechism of the Catholic Church Paragraphs:</p><br/><p>- 982 (in &#39;The Power of the Keys&#39;) - There is no offense, however serious, that the Church cannot forgive. &#34;There is no one, however wicked and guilty, who may not confidently hope for forgiveness, provided his repentance is honest. Christ who died for all men desires that in his Church the gates of forgiveness should always be open to anyone who turns away from sin.</p><br/><p>- 2227 (in &#39;The Duties of Parents&#39;) - Each and everyone should be generous and tireless in forgiving one another for offenses, quarrels, injustices, and neglect. Mutual affection suggests this. The charity of Christ demands it.</p><br/><p>- 2843 (in &#39;as we forgive those who trespass against us&#39;) - Thus the Lord&#39;s words on forgiveness, the love that loves to the end, become a living reality. the parable of the merciless servant, which crowns the Lord&#39;s teaching on ecclesial communion, ends with these words: &#34;So also my heavenly Father will do to every one of you, if you do not forgive your brother from your heart.&#34; It is there, in fact, &#34;in the depths of the heart,&#34; that everything is bound and loosed. It is not in our power not to feel or to forget an offense; but the heart that offers itself to the Holy Spirit turns injury into compassion and purifies the memory in transforming the hurt into intercession.</p><br/><p><br /></p><br/><p>Got a Bible question? Send an email to logicalbiblestudy&#64;gmail.com, and it will be answered in an upcoming episode!</p><br/>--- <br/>Send in a voice message: https://podcasters.spotify.com/pod/show/daily-gospel-exegesis/message",0SIROoNCHUsPGiaONSbBj3,"[{'height': 640, 'url': 'https://i.scdn.co/image/ab6765630000ba8aa10898a57fb4740a3aa6ef3f', 'width': 640}, {'height': 300, 'url': 'https://i.scdn.co/image/ab67656300005f1fa10898a57fb4740a3aa6ef3f', 'width': 300}, {'height': 64, 'url': 'https://i.scdn.co/image/ab6765630000f68da10898a57fb4740a3aa6ef3f', 'width': 64}]",False,True,en,['en'],Thursday of Week 19 in Ordinary Time - Matt 18:21-19:1,2023-08-16,day,episode,spotify:episode:0SIROoNCHUsPGiaONSbBj3,https://open.spotify.com/episode/0SIROoNCHUsPGiaONSbBj3,False,0,Matt 18:21-19:1,Matt,18.0
171,https://podz-content.spotifycdn.com/audio/clips/48sqfABTNUvqQFUdLxu5J9/clip_481097_541097.mp3,"To support the ministry and get access to exclusive content, go to: http://patreon.com/logicalbiblestudy  Matt 18: 21-35 - 'To be forgiven, you must forgive.'  Catechism of the Catholic Church Paragraphs: - 982 (in 'The Power of the Keys') - There is no offense, however serious, that the Church cannot forgive. ""There is no one, however wicked and guilty, who may not confidently hope for forgiveness, provided his repentance is honest. Christ who died for all men desires that in his Church the gates of forgiveness should always be open to anyone who turns away from sin. - 2227 (in 'The Duties of Parents') - Each and everyone should be generous and tireless in forgiving one another for offenses, quarrels, injustices, and neglect. Mutual affection suggests this. The charity of Christ demands it. - 2843 (in 'as we forgive those who trespass against us') - Thus the Lord's words on forgiveness, the love that loves to the end, become a living reality. the parable of the merciless servant, which crowns the Lord's teaching on ecclesial communion, ends with these words: ""So also my heavenly Father will do to every one of you, if you do not forgive your brother from your heart."" It is there, in fact, ""in the depths of the heart,"" that everything is bound and loosed. It is not in our power not to feel or to forget an offense; but the heart that offers itself to the Holy Spirit turns injury into compassion and purifies the memory in transforming the hurt into intercession.  Got a Bible question? Send an email to logicalbiblestudy@gmail.com, and it will be answered in an upcoming episode!  ---   Send in a voice message: https://podcasters.spotify.com/pod/show/daily-gospel-exegesis/message",1446905,False,https://api.spotify.com/v1/episodes/3F0YjKZNwpSnEWQo2bJmx5,"<p>To support the ministry and get access to exclusive content, go to: http://patreon.com/logicalbiblestudy</p><br/><p><br /></p><br/><p>Matt 18: 21-35 - &#39;To be forgiven, you must forgive.&#39;</p><br/><p><br /></p><br/><p>Catechism of the Catholic Church Paragraphs:</p><br/><p>- 982 (in &#39;The Power of the Keys&#39;) - There is no offense, however serious, that the Church cannot forgive. &#34;There is no one, however wicked and guilty, who may not confidently hope for forgiveness, provided his repentance is honest. Christ who died for all men desires that in his Church the gates of forgiveness should always be open to anyone who turns away from sin.</p><br/><p>- 2227 (in &#39;The Duties of Parents&#39;) - Each and everyone should be generous and tireless in forgiving one another for offenses, quarrels, injustices, and neglect. Mutual affection suggests this. The charity of Christ demands it.</p><br/><p>- 2843 (in &#39;as we forgive those who trespass against us&#39;) - Thus the Lord&#39;s words on forgiveness, the love that loves to the end, become a living reality. the parable of the merciless servant, which crowns the Lord&#39;s teaching on ecclesial communion, ends with these words: &#34;So also my heavenly Father will do to every one of you, if you do not forgive your brother from your heart.&#34; It is there, in fact, &#34;in the depths of the heart,&#34; that everything is bound and loosed. It is not in our power not to feel or to forget an offense; but the heart that offers itself to the Holy Spirit turns injury into compassion and purifies the memory in transforming the hurt into intercession.</p><br/><p><br /></p><br/><p>Got a Bible question? Send an email to logicalbiblestudy&#64;gmail.com, and it will be answered in an upcoming episode!</p><br/>--- <br/>Send in a voice message: https://podcasters.spotify.com/pod/show/daily-gospel-exegesis/message",3F0YjKZNwpSnEWQo2bJmx5,"[{'height': 640, 'url': 'https://i.scdn.co/image/ab6765630000ba8aa10898a57fb4740a3aa6ef3f', 'width': 640}, {'height': 300, 'url': 'https://i.scdn.co/image/ab67656300005f1fa10898a57fb4740a3aa6ef3f', 'width': 300}, {'height': 64, 'url': 'https://i.scdn.co/image/ab6765630000f68da10898a57fb4740a3aa6ef3f', 'width': 64}]",False,True,en,['en'],Tuesday of Week 3 of Lent - Matt 18: 21-35,2023-03-13,day,episode,spotify:episode:3F0YjKZNwpSnEWQo2bJmx5,https://open.spotify.com/episode/3F0YjKZNwpSnEWQo2bJmx5,False,0,Matt 18: 21-35,Matt,18.0
